{
  "schema_version": 1,
  "style": {
    "background": "#ffffff",
    "fill": "#ebebeb",
    "break_fill": "#ffffff",
    "stroke": "#000000",
    "stroke_width": 1,
    "font_size": 13,
    "font_family": "Helvetica",
    "text_fill": "#000000",
    "text_stroke": "none",
    "text_stroke_width": 0,
    "opacity": 1,
    "break_height": 20,
    "growth_arrow_size": 1,
    "growth_arrow_fill": "#ebebeb",
    "growth_arrow_stroke": "#000000",
    "min_section_height": 20,
    "max_section_height": 300,
    "label_arrow_size": 2
  },
  "links": {
    "shape": "polygon",
    "fill": "#d8d8d8",
    "stroke": "none",
    "opacity": 0.7
  },
  "labels": {
    "stroke": "#666666",
    "stroke_width": 1,
    "stroke_dasharray": "4,2"
  }
}
